{
  "$schema": "https://json-schema.org/draft/2020-12/schema",
  "$id": "https://goobers.dev/schemas/features.schema.json",
  "title": "FeaturesEnvelope",
  "description": "Machine-readable workflow-DSL feature discovery emitted by goobers features.",
  "type": "object",
  "additionalProperties": false,
  "required": ["schemaVersion", "version", "commit", "dslVersion", "features"],
  "properties": {
    "schemaVersion": { "const": "goobers.dev/features/v1" },
    "version": { "type": "string", "minLength": 1 },
    "commit": { "type": "string", "minLength": 1 },
    "dslVersion": { "type": "string", "minLength": 1 },
    "features": {
      "type": "array",
      "items": {
        "type": "object",
        "additionalProperties": false,
        "required": ["name", "stability", "sinceVersion", "runtimes"],
        "properties": {
          "name": { "type": "string", "minLength": 1 },
          "stability": {
            "type": "string",
            "enum": ["preview", "ga", "deprecated", "removed"]
          },
          "sinceVersion": { "type": "string", "minLength": 1 },
          "runtimes": {
            "description": "Support of this feature on each execution runtime.",
            "type": "array",
            "minItems": 2,
            "maxItems": 2,
            "items": {
              "type": "object",
              "additionalProperties": false,
              "required": ["runtime", "level", "since"],
              "properties": {
                "runtime": { "description": "Execution runtime.", "type": "string", "enum": ["runner", "engine"] },
                "level": { "description": "Whether the runtime implements the feature.", "type": "string", "enum": ["supported", "unsupported"] },
                "since": { "description": "Application version that introduced this runtime declaration.", "type": "string", "minLength": 1 }
              }
            }
          },
          "used": { "type": "boolean" }
        }
      }
    }
  }
}
