{
  "schemaVersion": "goobers.dev/features/v1",
  "version": "dev",
  "commit": "none",
  "dslVersion": "2.0",
  "features": [
    {
      "name": "gaggle.spec.additionalRepos",
      "stability": "ga",
      "sinceVersion": "dev",
      "runtimes": [
        {
          "runtime": "runner",
          "level": "supported",
          "since": "dev"
        },
        {
          "runtime": "engine",
          "level": "supported",
          "since": "dev"
        }
      ]
    },
    {
      "name": "gaggle.spec.additionalRepos.baseUrl",
      "stability": "ga",
      "sinceVersion": "dev",
      "runtimes": [
        {
          "runtime": "runner",
          "level": "supported",
          "since": "dev"
        },
        {
          "runtime": "engine",
          "level": "supported",
          "since": "dev"
        }
      ]
    },
    {
      "name": "gaggle.spec.additionalRepos.checkout.sparse",
      "stability": "ga",
      "sinceVersion": "dev",
      "runtimes": [
        {
          "runtime": "runner",
          "level": "supported",
          "since": "dev"
        },
        {
          "runtime": "engine",
          "level": "supported",
          "since": "dev"
        }
      ]
    },
    {
      "name": "gaggle.spec.additionalRepos.provider.ado",
      "stability": "ga",
      "sinceVersion": "dev",
      "runtimes": [
        {
          "runtime": "runner",
          "level": "supported",
          "since": "dev"
        },
        {
          "runtime": "engine",
          "level": "supported",
          "since": "dev"
        }
      ]
    },
    {
      "name": "gaggle.spec.additionalRepos.provider.gitea",
      "stability": "ga",
      "sinceVersion": "dev",
      "runtimes": [
        {
          "runtime": "runner",
          "level": "supported",
          "since": "dev"
        },
        {
          "runtime": "engine",
          "level": "supported",
          "since": "dev"
        }
      ]
    },
    {
      "name": "gaggle.spec.additionalRepos.provider.github",
      "stability": "ga",
      "sinceVersion": "dev",
      "runtimes": [
        {
          "runtime": "runner",
          "level": "supported",
          "since": "dev"
        },
        {
          "runtime": "engine",
          "level": "supported",
          "since": "dev"
        }
      ]
    },
    {
      "name": "gaggle.spec.backlog",
      "stability": "ga",
      "sinceVersion": "dev",
      "runtimes": [
        {
          "runtime": "runner",
          "level": "supported",
          "since": "dev"
        },
        {
          "runtime": "engine",
          "level": "supported",
          "since": "dev"
        }
      ]
    },
    {
      "name": "gaggle.spec.backlog.baseUrl",
      "stability": "ga",
      "sinceVersion": "dev",
      "runtimes": [
        {
          "runtime": "runner",
          "level": "supported",
          "since": "dev"
        },
        {
          "runtime": "engine",
          "level": "supported",
          "since": "dev"
        }
      ]
    },
    {
      "name": "gaggle.spec.backlog.fieldPredicate",
      "stability": "ga",
      "sinceVersion": "dev",
      "runtimes": [
        {
          "runtime": "runner",
          "level": "supported",
          "since": "dev"
        },
        {
          "runtime": "engine",
          "level": "supported",
          "since": "dev"
        }
      ]
    },
    {
      "name": "gaggle.spec.backlog.labelPredicate",
      "stability": "ga",
      "sinceVersion": "dev",
      "runtimes": [
        {
          "runtime": "runner",
          "level": "supported",
          "since": "dev"
        },
        {
          "runtime": "engine",
          "level": "supported",
          "since": "dev"
        }
      ]
    },
    {
      "name": "gaggle.spec.backlog.labels",
      "stability": "ga",
      "sinceVersion": "dev",
      "runtimes": [
        {
          "runtime": "runner",
          "level": "supported",
          "since": "dev"
        },
        {
          "runtime": "engine",
          "level": "supported",
          "since": "dev"
        }
      ]
    },
    {
      "name": "gaggle.spec.backlog.provider.ado",
      "stability": "ga",
      "sinceVersion": "dev",
      "runtimes": [
        {
          "runtime": "runner",
          "level": "supported",
          "since": "dev"
        },
        {
          "runtime": "engine",
          "level": "supported",
          "since": "dev"
        }
      ]
    },
    {
      "name": "gaggle.spec.backlog.provider.gitea",
      "stability": "ga",
      "sinceVersion": "dev",
      "runtimes": [
        {
          "runtime": "runner",
          "level": "supported",
          "since": "dev"
        },
        {
          "runtime": "engine",
          "level": "supported",
          "since": "dev"
        }
      ]
    },
    {
      "name": "gaggle.spec.backlog.provider.github",
      "stability": "ga",
      "sinceVersion": "dev",
      "runtimes": [
        {
          "runtime": "runner",
          "level": "supported",
          "since": "dev"
        },
        {
          "runtime": "engine",
          "level": "supported",
          "since": "dev"
        }
      ]
    },
    {
      "name": "gaggle.spec.branchNamespace",
      "stability": "ga",
      "sinceVersion": "dev",
      "runtimes": [
        {
          "runtime": "runner",
          "level": "supported",
          "since": "dev"
        },
        {
          "runtime": "engine",
          "level": "supported",
          "since": "dev"
        }
      ]
    },
    {
      "name": "gaggle.spec.ciCommand",
      "stability": "ga",
      "sinceVersion": "dev",
      "runtimes": [
        {
          "runtime": "runner",
          "level": "supported",
          "since": "dev"
        },
        {
          "runtime": "engine",
          "level": "supported",
          "since": "dev"
        }
      ]
    },
    {
      "name": "gaggle.spec.cost.enabled",
      "stability": "ga",
      "sinceVersion": "v0.4.0",
      "runtimes": [
        {
          "runtime": "runner",
          "level": "supported",
          "since": "v0.4.0"
        },
        {
          "runtime": "engine",
          "level": "supported",
          "since": "v0.4.0"
        }
      ]
    },
    {
      "name": "gaggle.spec.displayName",
      "stability": "ga",
      "sinceVersion": "dev",
      "runtimes": [
        {
          "runtime": "runner",
          "level": "supported",
          "since": "dev"
        },
        {
          "runtime": "engine",
          "level": "supported",
          "since": "dev"
        }
      ]
    },
    {
      "name": "gaggle.spec.enabled",
      "stability": "ga",
      "sinceVersion": "v0.4.0",
      "runtimes": [
        {
          "runtime": "runner",
          "level": "supported",
          "since": "v0.4.0"
        },
        {
          "runtime": "engine",
          "level": "supported",
          "since": "v0.4.0"
        }
      ]
    },
    {
      "name": "gaggle.spec.health",
      "stability": "ga",
      "sinceVersion": "dev",
      "runtimes": [
        {
          "runtime": "runner",
          "level": "supported",
          "since": "dev"
        },
        {
          "runtime": "engine",
          "level": "supported",
          "since": "dev"
        }
      ]
    },
    {
      "name": "gaggle.spec.isolation.identityRef",
      "stability": "ga",
      "sinceVersion": "dev",
      "runtimes": [
        {
          "runtime": "runner",
          "level": "supported",
          "since": "dev"
        },
        {
          "runtime": "engine",
          "level": "supported",
          "since": "dev"
        }
      ]
    },
    {
      "name": "gaggle.spec.isolation.namespace",
      "stability": "ga",
      "sinceVersion": "dev",
      "runtimes": [
        {
          "runtime": "runner",
          "level": "supported",
          "since": "dev"
        },
        {
          "runtime": "engine",
          "level": "supported",
          "since": "dev"
        }
      ]
    },
    {
      "name": "gaggle.spec.isolation.serviceAccount",
      "stability": "ga",
      "sinceVersion": "dev",
      "runtimes": [
        {
          "runtime": "runner",
          "level": "supported",
          "since": "dev"
        },
        {
          "runtime": "engine",
          "level": "supported",
          "since": "dev"
        }
      ]
    },
    {
      "name": "gaggle.spec.issueOwnershipScope",
      "stability": "ga",
      "sinceVersion": "dev",
      "runtimes": [
        {
          "runtime": "runner",
          "level": "supported",
          "since": "dev"
        },
        {
          "runtime": "engine",
          "level": "supported",
          "since": "dev"
        }
      ]
    },
    {
      "name": "gaggle.spec.issueOwnershipScope.assignees",
      "stability": "ga",
      "sinceVersion": "dev",
      "runtimes": [
        {
          "runtime": "runner",
          "level": "supported",
          "since": "dev"
        },
        {
          "runtime": "engine",
          "level": "supported",
          "since": "dev"
        }
      ]
    },
    {
      "name": "gaggle.spec.issueOwnershipScope.unassigned",
      "stability": "ga",
      "sinceVersion": "dev",
      "runtimes": [
        {
          "runtime": "runner",
          "level": "supported",
          "since": "dev"
        },
        {
          "runtime": "engine",
          "level": "supported",
          "since": "dev"
        }
      ]
    },
    {
      "name": "gaggle.spec.outboxMirrorPath",
      "stability": "ga",
      "sinceVersion": "dev",
      "runtimes": [
        {
          "runtime": "runner",
          "level": "supported",
          "since": "dev"
        },
        {
          "runtime": "engine",
          "level": "supported",
          "since": "dev"
        }
      ]
    },
    {
      "name": "gaggle.spec.project",
      "stability": "ga",
      "sinceVersion": "dev",